{
  "app": "nebula",
  "name": "ACCOUNT_TOKEN_CHANGE",
  "properties": [
    {
      "name": "uid",
      "remark": "修改凭证账号",
      "type": "string",
      "visible_name": "修改凭证账号"
    },
    {
      "name": "old_token",
      "remark": "原凭证",
      "type": "string",
      "visible_name": "原凭证"
    },
    {
      "name": "new_token",
      "remark": "新凭证",
      "type": "string",
      "visible_name": "新凭证"
    },
    {
      "name": "token_type",
      "remark": "凭证类型",
      "type": "string",
      "visible_name": "凭证类型"
    },
    {
      "name": "captcha",
      "remark": "图片验证码",
      "type": "string",
      "visible_name": "图片验证码"
    },
    {
      "name": "result",
      "remark": "修改结果",
      "type": "string",
      "visible_name": "修改结果"
    }
  ],
  "remark": "账号-安全凭证修改",
  "source": [
    {
      "app": "nebula",
      "name": "HTTP_DYNAMIC"
    }
  ],
  "type": "base",
  "version": "1.0",
  "visible_name": "账号-安全凭证修改"
}
