{
  "app": "nebula",
  "name": "TRANSACTION_DEPOSIT",
  "properties": [
    {
      "name": "uid",
      "remark": "用户账户",
      "type": "string",
      "visible_name": "用户账户"
    },
    {
      "name": "transaction_id",
      "remark": "充值流水号",
      "type": "string",
      "visible_name": "充值流水号"
    },
    {
      "name": "deposit_amount",
      "remark": "充值金额",
      "type": "long",
      "visible_name": "充值金额"
    },
    {
      "name": "card_number",
      "remark": "充值卡号",
      "type": "string",
      "visible_name": "充值卡号"
    },
    {
      "name": "user_name",
      "remark": "交易相关用户(授予人)",
      "type": "string",
      "visible_name": "交易相关用户"
    },
    {
      "name": "account_balance_before",
      "remark": "充值前账户余额",
      "type": "double",
      "visible_name": "充值前账户余额"
    },
    {
      "name": "result",
      "remark": "充值结果",
      "type": "string",
      "visible_name": "充值结果"
    }
  ],
  "remark": "支付-充值",
  "source": [
    {
      "app": "nebula",
      "name": "HTTP_DYNAMIC"
    }
  ],
  "type": "base",
  "version": "1.0",
  "visible_name": "支付-充值"
}
